{
  "$schema": "https://sunder.dev/eng/execution-runtimes/lock-v1.schema.json",
  "schemaVersion": 1,
  "lockKind": "test-fixture",
  "coverage": {
    "runtimes": [
      { "id": "sunder.runtime.dotnet", "major": 10 },
      { "id": "sunder.runtime.node", "major": 24 }
    ],
    "rids": ["win-x64", "win-arm64", "linux-x64", "linux-arm64", "osx-x64", "osx-arm64"]
  },
  "entries": [
    {
      "id": "sunder.runtime.dotnet",
      "version": "10.0.1",
      "packagingRevision": 1,
      "minimumHostTrustGeneration": 1,
      "supportLine": "lts",
      "defaultStatus": "supported",
      "rid": "win-x64",
      "source": {
        "name": "dotnet",
        "publisher": "microsoft-dotnet",
        "uri": "https://fixtures.invalid/execution-runtimes/dotnet/10.0.1/win-x64.fixture.json",
        "sha256": "3ed33dc757e0e2f432441fdb55e30c354f7dbd54b0e78643ddf48cc0004c0686",
        "archiveFormat": "fixture-json",
        "sourceRoot": "dotnet-10.0.1-win-x64"
      },
      "license": {
        "spdx": ["MIT"],
        "files": [{ "path": "LICENSE.txt", "sha256": "d083fcbe20d8c862faa66e24c331a4644b6196f237816beeb1f0f0e267f1e90d" }]
      },
      "profile": {
        "name": "dotnet-worker-v1",
        "moduleAbi": "sunder.dotnet-worker-module.v1",
        "workerProtocol": "sunder.worker.v1",
        "launchExecutable": "payload/runtime/dotnet.exe",
        "launchArguments": ["exec", "{package.entryPoint}"]
      },
      "recipe": {
        "name": "repackage-upstream-tree-v1",
        "payloadRoot": "payload/runtime",
        "launcherSource": "dotnet.exe",
        "excludedSourcePaths": [],
        "toolchain": { "name": "dotnet-sdk", "version": "10.0.100" },
        "smokeArguments": ["--info"]
      },
      "trust": {
        "scope": "test-only",
        "sourceApproval": {
          "status": "synthetic-fixture",
          "reference": "https://fixtures.invalid/approvals/dotnet/10.0.1/win-x64",
          "approvedBy": "sunder.execution-runtime.tests"
        },
        "releaseSigningKeyId": "sunder.release.test.v1",
        "attestationSigningKeyId": "sunder.ci.test.v1",
        "attestationWorkflow": "sunder.runtime.fixture",
        "nativeRunner": "fixture-win-x64",
        "platformSignature": "required",
        "notarization": "not-applicable"
      }
    },
    {
      "id": "sunder.runtime.dotnet",
      "version": "10.0.1",
      "packagingRevision": 1,
      "minimumHostTrustGeneration": 1,
      "supportLine": "lts",
      "defaultStatus": "supported",
      "rid": "win-arm64",
      "source": {
        "name": "dotnet",
        "publisher": "microsoft-dotnet",
        "uri": "https://fixtures.invalid/execution-runtimes/dotnet/10.0.1/win-arm64.fixture.json",
        "sha256": "01ab83833e15a455dc504d331fefffe7d73d683a85fddb90f246e6d79cdbf525",
        "archiveFormat": "fixture-json",
        "sourceRoot": "dotnet-10.0.1-win-arm64"
      },
      "license": {
        "spdx": ["MIT"],
        "files": [{ "path": "LICENSE.txt", "sha256": "d083fcbe20d8c862faa66e24c331a4644b6196f237816beeb1f0f0e267f1e90d" }]
      },
      "profile": {
        "name": "dotnet-worker-v1",
        "moduleAbi": "sunder.dotnet-worker-module.v1",
        "workerProtocol": "sunder.worker.v1",
        "launchExecutable": "payload/runtime/dotnet.exe",
        "launchArguments": ["exec", "{package.entryPoint}"]
      },
      "recipe": {
        "name": "repackage-upstream-tree-v1",
        "payloadRoot": "payload/runtime",
        "launcherSource": "dotnet.exe",
        "excludedSourcePaths": [],
        "toolchain": { "name": "dotnet-sdk", "version": "10.0.100" },
        "smokeArguments": ["--info"]
      },
      "trust": {
        "scope": "test-only",
        "sourceApproval": {
          "status": "synthetic-fixture",
          "reference": "https://fixtures.invalid/approvals/dotnet/10.0.1/win-arm64",
          "approvedBy": "sunder.execution-runtime.tests"
        },
        "releaseSigningKeyId": "sunder.release.test.v1",
        "attestationSigningKeyId": "sunder.ci.test.v1",
        "attestationWorkflow": "sunder.runtime.fixture",
        "nativeRunner": "fixture-win-arm64",
        "platformSignature": "required",
        "notarization": "not-applicable"
      }
    },
    {
      "id": "sunder.runtime.dotnet",
      "version": "10.0.1",
      "packagingRevision": 1,
      "minimumHostTrustGeneration": 1,
      "supportLine": "lts",
      "defaultStatus": "supported",
      "rid": "linux-x64",
      "source": {
        "name": "dotnet",
        "publisher": "microsoft-dotnet",
        "uri": "https://fixtures.invalid/execution-runtimes/dotnet/10.0.1/linux-x64.fixture.json",
        "sha256": "d70e83e1092a2631f3cfb44d11b1d64836c40e387738f04bf89253fcd2d4b87d",
        "archiveFormat": "fixture-json",
        "sourceRoot": "dotnet-10.0.1-linux-x64"
      },
      "license": {
        "spdx": ["MIT"],
        "files": [{ "path": "LICENSE.txt", "sha256": "d083fcbe20d8c862faa66e24c331a4644b6196f237816beeb1f0f0e267f1e90d" }]
      },
      "profile": {
        "name": "dotnet-worker-v1",
        "moduleAbi": "sunder.dotnet-worker-module.v1",
        "workerProtocol": "sunder.worker.v1",
        "launchExecutable": "payload/runtime/dotnet",
        "launchArguments": ["exec", "{package.entryPoint}"]
      },
      "recipe": {
        "name": "repackage-upstream-tree-v1",
        "payloadRoot": "payload/runtime",
        "launcherSource": "dotnet",
        "excludedSourcePaths": [],
        "toolchain": { "name": "dotnet-sdk", "version": "10.0.100" },
        "smokeArguments": ["--info"]
      },
      "trust": {
        "scope": "test-only",
        "sourceApproval": {
          "status": "synthetic-fixture",
          "reference": "https://fixtures.invalid/approvals/dotnet/10.0.1/linux-x64",
          "approvedBy": "sunder.execution-runtime.tests"
        },
        "releaseSigningKeyId": "sunder.release.test.v1",
        "attestationSigningKeyId": "sunder.ci.test.v1",
        "attestationWorkflow": "sunder.runtime.fixture",
        "nativeRunner": "fixture-linux-x64",
        "platformSignature": "not-applicable",
        "notarization": "not-applicable"
      }
    },
    {
      "id": "sunder.runtime.dotnet",
      "version": "10.0.1",
      "packagingRevision": 1,
      "minimumHostTrustGeneration": 1,
      "supportLine": "lts",
      "defaultStatus": "supported",
      "rid": "linux-arm64",
      "source": {
        "name": "dotnet",
        "publisher": "microsoft-dotnet",
        "uri": "https://fixtures.invalid/execution-runtimes/dotnet/10.0.1/linux-arm64.fixture.json",
        "sha256": "76b30d3c800043251fb94a159bdc92d6d27f7645afeb21351e7b31f1ac96b515",
        "archiveFormat": "fixture-json",
        "sourceRoot": "dotnet-10.0.1-linux-arm64"
      },
      "license": {
        "spdx": ["MIT"],
        "files": [{ "path": "LICENSE.txt", "sha256": "d083fcbe20d8c862faa66e24c331a4644b6196f237816beeb1f0f0e267f1e90d" }]
      },
      "profile": {
        "name": "dotnet-worker-v1",
        "moduleAbi": "sunder.dotnet-worker-module.v1",
        "workerProtocol": "sunder.worker.v1",
        "launchExecutable": "payload/runtime/dotnet",
        "launchArguments": ["exec", "{package.entryPoint}"]
      },
      "recipe": {
        "name": "repackage-upstream-tree-v1",
        "payloadRoot": "payload/runtime",
        "launcherSource": "dotnet",
        "excludedSourcePaths": [],
        "toolchain": { "name": "dotnet-sdk", "version": "10.0.100" },
        "smokeArguments": ["--info"]
      },
      "trust": {
        "scope": "test-only",
        "sourceApproval": {
          "status": "synthetic-fixture",
          "reference": "https://fixtures.invalid/approvals/dotnet/10.0.1/linux-arm64",
          "approvedBy": "sunder.execution-runtime.tests"
        },
        "releaseSigningKeyId": "sunder.release.test.v1",
        "attestationSigningKeyId": "sunder.ci.test.v1",
        "attestationWorkflow": "sunder.runtime.fixture",
        "nativeRunner": "fixture-linux-arm64",
        "platformSignature": "not-applicable",
        "notarization": "not-applicable"
      }
    },
    {
      "id": "sunder.runtime.dotnet",
      "version": "10.0.1",
      "packagingRevision": 1,
      "minimumHostTrustGeneration": 1,
      "supportLine": "lts",
      "defaultStatus": "supported",
      "rid": "osx-x64",
      "source": {
        "name": "dotnet",
        "publisher": "microsoft-dotnet",
        "uri": "https://fixtures.invalid/execution-runtimes/dotnet/10.0.1/osx-x64.fixture.json",
        "sha256": "532c68a3b6abc55a95295644e90a59002ca1c932c29bf2ada1e8fae7fc72b845",
        "archiveFormat": "fixture-json",
        "sourceRoot": "dotnet-10.0.1-osx-x64"
      },
      "license": {
        "spdx": ["MIT"],
        "files": [{ "path": "LICENSE.txt", "sha256": "d083fcbe20d8c862faa66e24c331a4644b6196f237816beeb1f0f0e267f1e90d" }]
      },
      "profile": {
        "name": "dotnet-worker-v1",
        "moduleAbi": "sunder.dotnet-worker-module.v1",
        "workerProtocol": "sunder.worker.v1",
        "launchExecutable": "payload/runtime/dotnet",
        "launchArguments": ["exec", "{package.entryPoint}"]
      },
      "recipe": {
        "name": "repackage-upstream-tree-v1",
        "payloadRoot": "payload/runtime",
        "launcherSource": "dotnet",
        "excludedSourcePaths": [],
        "toolchain": { "name": "dotnet-sdk", "version": "10.0.100" },
        "smokeArguments": ["--info"]
      },
      "trust": {
        "scope": "test-only",
        "sourceApproval": {
          "status": "synthetic-fixture",
          "reference": "https://fixtures.invalid/approvals/dotnet/10.0.1/osx-x64",
          "approvedBy": "sunder.execution-runtime.tests"
        },
        "releaseSigningKeyId": "sunder.release.test.v1",
        "attestationSigningKeyId": "sunder.ci.test.v1",
        "attestationWorkflow": "sunder.runtime.fixture",
        "nativeRunner": "fixture-osx-x64",
        "platformSignature": "required",